{
  "current_task": "Plan a team training session",
  "candidate_memory": "The user prefers quiet solo climbing routes",
  "proposed_memory_action": "USE",
  "permission": "ALLOWED",
  "relationship": "NO_BRIDGE",
  "evidence_status": "SUFFICIENT",
  "robust_action_available": false,
  "risk": "LOW",
  "evidence": [
    {"id": "SOURCE", "text": "Personal climbing preference record", "kind": "MEMORY_SOURCE", "decisive": false},
    {"id": "BOUNDARY", "text": "No affirmative transfer evidence from solo climbing to team training", "kind": "APPLICABILITY", "decisive": true}
  ]
}
